{
  "$schema": "https://json-schema.org/draft/2020-12/schema",
  "$id": "https://nextstat.io/schemas/tools/nextstat_agent_bootstrap_pack_v1.schema.json",
  "title": "NextStat Agent Bootstrap Pack v1",
  "type": "object",
  "additionalProperties": false,
  "required": [
    "schema_version",
    "client",
    "transport",
    "title",
    "summary",
    "discovery_contract",
    "instructions",
    "recipes",
    "snippets",
    "references"
  ],
  "properties": {
    "schema_version": {
      "const": "nextstat.agent_bootstrap_pack.v1"
    },
    "client": {
      "type": "string",
      "enum": [
        "codex",
        "gemini",
        "claude",
        "ollama",
        "mcp",
        "ide"
      ]
    },
    "transport": {
      "type": "string",
      "enum": [
        "local",
        "server"
      ]
    },
    "title": {
      "type": "string",
      "minLength": 1
    },
    "summary": {
      "type": "string",
      "minLength": 1
    },
    "discovery_contract": {
      "type": "object",
      "additionalProperties": false,
      "required": [
        "descriptor_schema_version",
        "callable_surface",
        "policy_surface",
        "guidance_surface"
      ],
      "properties": {
        "descriptor_schema_version": {
          "const": "nextstat.tool_schema.v1"
        },
        "callable_surface": {
          "const": "tools"
        },
        "policy_surface": {
          "const": "capabilities"
        },
        "guidance_surface": {
          "const": "guidance"
        }
      }
    },
    "instructions": {
      "type": "array",
      "minItems": 1,
      "items": {
        "type": "string",
        "minLength": 1
      }
    },
    "recipes": {
      "type": "array",
      "minItems": 1,
      "items": {
        "$ref": "#/$defs/recipe"
      }
    },
    "snippets": {
      "type": "object",
      "additionalProperties": false,
      "required": [
        "bootstrap",
        "execution_loop"
      ],
      "properties": {
        "bootstrap": {
          "type": "string",
          "minLength": 1
        },
        "execution_loop": {
          "type": "string",
          "minLength": 1
        }
      }
    },
    "references": {
      "type": "array",
      "minItems": 1,
      "items": {
        "type": "string",
        "minLength": 1
      }
    }
  },
  "$defs": {
    "recipe": {
      "type": "object",
      "additionalProperties": false,
      "required": [
        "id",
        "transport",
        "title",
        "summary",
        "prompt",
        "tools",
        "docs"
      ],
      "properties": {
        "id": {
          "type": "string",
          "pattern": "^[a-z0-9_]+$"
        },
        "transport": {
          "type": "string",
          "enum": [
            "local",
            "server"
          ]
        },
        "title": {
          "type": "string",
          "minLength": 1
        },
        "summary": {
          "type": "string",
          "minLength": 1
        },
        "prompt": {
          "type": "string",
          "minLength": 1
        },
        "tools": {
          "type": "array",
          "minItems": 1,
          "items": {
            "type": "string",
            "pattern": "^nextstat_[a-z0-9_]+$"
          }
        },
        "docs": {
          "type": "array",
          "minItems": 1,
          "items": {
            "type": "string",
            "minLength": 1
          }
        }
      }
    }
  }
}
